{
  "schema": "@baron1996/drawable-workspace",
  "version": 1,
  "runtime": {
    "engine": "klinecharts",
    "engineVersion": "10.0.0",
    "workspaceRuntimeVersion": "1.0.0"
  },
  "scene": {
    "kind": "time-series",
    "document": {
      "schema": "@baron1996/time-series-scene",
      "version": 1,
      "runtime": {
        "engine": "klinecharts",
        "engineVersion": "10.0.0",
        "runtimeVersion": "0.1.0"
      },
      "period": {
        "span": 1,
        "type": "day"
      },
      "series": [
        {
          "id": "series-a",
          "name": "Series A",
          "type": "line",
          "unit": "unit",
          "precision": 2,
          "visible": true,
          "style": {
            "color": "rgba(96, 165, 250, 1)",
            "size": 2,
            "style": "solid"
          }
        },
        {
          "id": "series-b",
          "name": "Series B",
          "type": "line",
          "unit": "unit",
          "precision": 2,
          "visible": true,
          "style": {
            "color": "rgba(249, 115, 22, 1)",
            "size": 2,
            "style": "dashed"
          }
        },
        {
          "id": "series-total",
          "name": "Series Total",
          "type": "line",
          "unit": "unit",
          "precision": 2,
          "visible": true,
          "style": {
            "color": "rgba(52, 211, 153, 1)",
            "size": 2,
            "style": "dotted"
          }
        }
      ],
      "data": [
        {
          "timestamp": 1767225600000,
          "values": {
            "series-a": 12.34,
            "series-b": 20,
            "series-total": 32.34
          }
        },
        {
          "timestamp": 1767312000000,
          "values": {
            "series-a": 15.67,
            "series-b": null,
            "series-total": 35.67
          }
        }
      ],
      "chart": {
        "locale": "zh-CN",
        "timezone": "Asia/Shanghai",
        "layout": {
          "backgroundColor": "rgba(17, 24, 39, 1)",
          "textColor": "rgba(219, 234, 254, 1)",
          "fontFamily": "Baron Sans",
          "fontSize": 12
        },
        "grid": {
          "horizontalColor": "rgba(48, 59, 78, 1)",
          "verticalColor": "rgba(48, 59, 78, 1)"
        },
        "thousandsSeparator": ",",
        "decimalFold": {
          "enabled": false,
          "threshold": 4
        },
        "zoomAnchor": "cursor",
        "dateFormat": "yyyy-MM-dd",
        "largeNumberFormat": "chinese"
      },
      "viewport": {
        "barSpace": 8,
        "rightOffsetDistance": 24,
        "anchorTimestamp": 1767312000000
      },
      "render": {
        "width": 1280,
        "height": 720,
        "deviceScaleFactor": 1,
        "background": "rgba(17, 24, 39, 1)",
        "fontFamily": "Baron Sans",
        "timeoutMs": 10000
      },
      "metadata": {}
    }
  },
  "drawings": {
    "schema": "@baron1996/drawing-document",
    "version": 1,
    "scopeKey": "fixture-instrument-000001",
    "coordinateSystem": {
      "timezone": "Asia/Shanghai",
      "valueAxes": [
        {
          "paneRole": "time-series",
          "yAxisRole": "primary",
          "valuePrecision": 2
        }
      ]
    },
    "drawings": [
      {
        "id": "drawing-horizontalStraightLine-1",
        "target": {
          "paneRole": "time-series",
          "yAxisRole": "primary"
        },
        "visible": true,
        "locked": false,
        "zLevel": 0,
        "mode": "normal",
        "styles": {
          "line": {
            "color": "rgba(41, 98, 255, 1)",
            "size": 1,
            "style": "solid"
          },
          "fill": {
            "color": "rgba(41, 98, 255, 0.15)"
          },
          "text": {
            "color": "rgba(255, 255, 255, 1)",
            "size": 12,
            "family": "Baron Sans",
            "weight": "normal",
            "backgroundColor": "rgba(41, 98, 255, 1)",
            "borderColor": "rgba(41, 98, 255, 1)"
          }
        },
        "metadata": {},
        "type": "horizontalStraightLine",
        "geometry": {
          "value": 12.55
        }
      },
      {
        "id": "drawing-priceLine-2",
        "target": {
          "paneRole": "time-series",
          "yAxisRole": "primary"
        },
        "visible": true,
        "locked": false,
        "zLevel": 1,
        "mode": "normal",
        "styles": {
          "line": {
            "color": "rgba(41, 98, 255, 1)",
            "size": 1,
            "style": "solid"
          },
          "fill": {
            "color": "rgba(41, 98, 255, 0.15)"
          },
          "text": {
            "color": "rgba(255, 255, 255, 1)",
            "size": 12,
            "family": "Baron Sans",
            "weight": "normal",
            "backgroundColor": "rgba(41, 98, 255, 1)",
            "borderColor": "rgba(41, 98, 255, 1)"
          }
        },
        "metadata": {},
        "type": "priceLine",
        "geometry": {
          "value": 12.55
        }
      },
      {
        "id": "drawing-simpleTag-3",
        "target": {
          "paneRole": "time-series",
          "yAxisRole": "primary"
        },
        "visible": true,
        "locked": false,
        "zLevel": 2,
        "mode": "normal",
        "styles": {
          "line": {
            "color": "rgba(41, 98, 255, 1)",
            "size": 1,
            "style": "solid"
          },
          "fill": {
            "color": "rgba(41, 98, 255, 0.15)"
          },
          "text": {
            "color": "rgba(255, 255, 255, 1)",
            "size": 12,
            "family": "Baron Sans",
            "weight": "normal",
            "backgroundColor": "rgba(41, 98, 255, 1)",
            "borderColor": "rgba(41, 98, 255, 1)"
          }
        },
        "metadata": {},
        "type": "simpleTag",
        "geometry": {
          "value": 12.55,
          "text": "tag"
        }
      },
      {
        "id": "drawing-verticalStraightLine-4",
        "target": {
          "paneRole": "time-series",
          "yAxisRole": "primary"
        },
        "visible": true,
        "locked": false,
        "zLevel": 3,
        "mode": "normal",
        "styles": {
          "line": {
            "color": "rgba(41, 98, 255, 1)",
            "size": 1,
            "style": "solid"
          },
          "fill": {
            "color": "rgba(41, 98, 255, 0.15)"
          },
          "text": {
            "color": "rgba(255, 255, 255, 1)",
            "size": 12,
            "family": "Baron Sans",
            "weight": "normal",
            "backgroundColor": "rgba(41, 98, 255, 1)",
            "borderColor": "rgba(41, 98, 255, 1)"
          }
        },
        "metadata": {},
        "type": "verticalStraightLine",
        "geometry": {
          "time": 1784736000000
        }
      },
      {
        "id": "drawing-horizontalRayLine-5",
        "target": {
          "paneRole": "time-series",
          "yAxisRole": "primary"
        },
        "visible": true,
        "locked": false,
        "zLevel": 4,
        "mode": "normal",
        "styles": {
          "line": {
            "color": "rgba(41, 98, 255, 1)",
            "size": 1,
            "style": "solid"
          },
          "fill": {
            "color": "rgba(41, 98, 255, 0.15)"
          },
          "text": {
            "color": "rgba(255, 255, 255, 1)",
            "size": 12,
            "family": "Baron Sans",
            "weight": "normal",
            "backgroundColor": "rgba(41, 98, 255, 1)",
            "borderColor": "rgba(41, 98, 255, 1)"
          }
        },
        "metadata": {},
        "type": "horizontalRayLine",
        "geometry": {
          "value": 12.55,
          "startTime": 1784736000000,
          "endTime": 1784908800000
        }
      },
      {
        "id": "drawing-horizontalSegment-6",
        "target": {
          "paneRole": "time-series",
          "yAxisRole": "primary"
        },
        "visible": true,
        "locked": false,
        "zLevel": 5,
        "mode": "normal",
        "styles": {
          "line": {
            "color": "rgba(41, 98, 255, 1)",
            "size": 1,
            "style": "solid"
          },
          "fill": {
            "color": "rgba(41, 98, 255, 0.15)"
          },
          "text": {
            "color": "rgba(255, 255, 255, 1)",
            "size": 12,
            "family": "Baron Sans",
            "weight": "normal",
            "backgroundColor": "rgba(41, 98, 255, 1)",
            "borderColor": "rgba(41, 98, 255, 1)"
          }
        },
        "metadata": {},
        "type": "horizontalSegment",
        "geometry": {
          "value": 12.55,
          "startTime": 1784736000000,
          "endTime": 1784908800000
        }
      },
      {
        "id": "drawing-verticalRayLine-7",
        "target": {
          "paneRole": "time-series",
          "yAxisRole": "primary"
        },
        "visible": true,
        "locked": false,
        "zLevel": 6,
        "mode": "normal",
        "styles": {
          "line": {
            "color": "rgba(41, 98, 255, 1)",
            "size": 1,
            "style": "solid"
          },
          "fill": {
            "color": "rgba(41, 98, 255, 0.15)"
          },
          "text": {
            "color": "rgba(255, 255, 255, 1)",
            "size": 12,
            "family": "Baron Sans",
            "weight": "normal",
            "backgroundColor": "rgba(41, 98, 255, 1)",
            "borderColor": "rgba(41, 98, 255, 1)"
          }
        },
        "metadata": {},
        "type": "verticalRayLine",
        "geometry": {
          "time": 1784822400000,
          "startValue": 12.34,
          "endValue": 12.74
        }
      },
      {
        "id": "drawing-verticalSegment-8",
        "target": {
          "paneRole": "time-series",
          "yAxisRole": "primary"
        },
        "visible": true,
        "locked": false,
        "zLevel": 7,